{
  "fileId": "file-1",
  "fileVersion": 0,
  "created": [
      {
        "partId": "part-rec-demo-001",
        "sourceFileId": "file-1",
        "sourceEntityIds": ["ent-1"],
        "geometry": {"boundingBox": {"minX": 0, "minY": 0, "maxX": 120, "maxY": 60}, "area": 7200},
        "entities": [{"id": "ent-1", "type": "line", "start": {"x": 0, "y": 0}, "end": {"x": 120, "y": 60}}],
        "metadata": {"source": "force-set", "forced": true, "validationStatus": "HAS_ISSUES", "validationIssues": [{"id": "issue-1", "type": "unclosed_contour", "level": "info", "message": "轮廓不封闭"}]},
        "createdAt": "2026-02-14T08:00:00Z",
        "storagePath": "/Users/alex/Code/mf/drawing/api/.mock-data/parts/part-rec-demo-001.json"
      }
    ],
  "inspection": {
    "fileId": "file-1",
    "timestamp": 1771000000000,
    "tolerance": 0.5,
    "summary": {
      "total": 1,
      "info": 1,
      "warning": 0,
      "error": 0
    },
    "issues": [
      {
        "id": "issue-1",
        "type": "unclosed_contour",
        "level": "info",
        "message": "轮廓不封闭",
        "fileId": "file-1",
        "entities": ["ent-1"],
        "location": {
          "position": { "x": 10, "y": 20 },
          "radius": 12
        }
      }
    ],
    "recommendations": ["建议先封闭轮廓"]
  }
}
